{
  "genome_schema": "0.1.0",
  "id": "ambient-backdrop",
  "title": "Generative backdrops",
  "summary": "Moving backgrounds generated by code: aurora gradients, bokeh, rippling dot grids, mesh-gradient shaders and flow-field line art, used behind cards and scenes.",
  "family": "generative",
  "formats": [
    "any"
  ],
  "duration_seconds": [
    4,
    60
  ],
  "recipes": [
    "visual.aurora",
    "visual.bokeh",
    "visual.dot-wave",
    "visual.shader-gradient",
    "visual.flow-lines"
  ],
  "templates": [],
  "prompt": "prompt.md",
  "needs": [],
  "techniques": [
    "numpy",
    "WebGL fragment shaders",
    "Canvas 2D",
    "OKLab palettes"
  ],
  "limits": [
    "Backgrounds, not finished videos: templates use them behind copy"
  ]
}
